{
  "@context": [
    "http://www.w3.org/ns/anno.jsonld",
    "http://iiif.io/api/presentation/3/context.json"
  ],
  "id": "https://fossda.theirstory.io/video/larry-augustin",
  "type": "OralHistory",
  "label": {
    "en": ["Larry Augustin Interview - FOSSDA Oral History Project"]
  },
  "title": "Larry Augustin Interview - FOSSDA Oral History Project",
  "summary": {
    "en": [
      "An oral history interview with Larry Augustin, entrepreneur and open source pioneer, discussing his career from founding VA Linux to angel investing. Topics include the origins of the open source movement, early Linux commercialization, and the evolution of technology entrepreneurship."
    ]
  },
  "description": "Larry Augustin, founder of VA Research/VA Linux and SourceForge, discusses his journey from electrical engineering to open source entrepreneurship. The interview covers his childhood in Ohio, education at Notre Dame and Stanford, involvement in coining the term 'open source,' building VA Linux, work at SugarCRM and AWS, and current work as an angel investor focusing on AI and open source technologies.",
  "metadata": [
    {
      "label": {"en": ["Organization"]},
      "value": {"en": ["FOSSDA - Free and Open Source Stories Digital Archive Foundation"]}
    },
    {
      "label": {"en": ["Recording Platform"]},
      "value": {"en": ["theirstory.io"]}
    },
    {
      "label": {"en": ["Interview Type"]},
      "value": {"en": ["Oral History"]}
    },
    {
      "label": {"en": ["Subject Areas"]},
      "value": {"en": ["Computer Science", "Open Source Software", "Entrepreneurship", "Technology History"]}
    }
  ],
  "created": "2024-04-16T00:00:00Z",
  "modified": "2024-04-16T18:00:00Z",
  "duration": 6129,
  "language": ["en"],
  "participants": [
    {
      "id": "participant-001",
      "name": "Elisabetta Mori",
      "role": "interviewer",
      "bio": "Historian of computing currently based in Italy, conducting oral history interviews for FOSSDA",
      "affiliations": ["FOSSDA"],
      "identifiers": {}
    },
    {
      "id": "participant-002",
      "name": "Larry Augustin",
      "role": "interviewee",
      "bio": "Entrepreneur, angel investor, and advisor to technology companies. Founder of VA Research/VA Linux and SourceForge, former CEO of SugarCRM, and Vice President at Amazon Web Services. Pioneer in open source commercialization.",
      "affiliations": ["VA Linux Systems", "SourceForge", "SugarCRM", "Amazon Web Services"],
      "identifiers": {
        "wikidata": "Q6490196"
      }
    }
  ],
  "location": {
    "recording_location": {
      "name": "Remote Interview via theirstory.io",
      "description": "Distributed recording session"
    },
    "participant_locations": [
      {
        "participant_id": "participant-001",
        "location": {
          "name": "Home",
          "city": "Livorno",
          "region": "Tuscany",
          "country": "Italy"
        }
      },
      {
        "participant_id": "participant-002",
        "location": {
          "name": "Home",
          "city": "Los Altos",
          "region": "California",
          "country": "United States"
        }
      }
    ]
  },
  "rights": "https://creativecommons.org/licenses/by-nc-sa/4.0/",
  "requiredStatement": {
    "label": {"en": ["Attribution"]},
    "value": {"en": ["© 2024 FOSSDA. This interview is licensed under CC BY-NC-SA 4.0. Please cite as: Mori, Elisabetta. Interview with Larry Augustin. FOSSDA Oral History Project. April 16, 2024."]}
  },
  "provider": [
    {
      "id": "https://fossda.org",
      "type": "Agent",
      "label": {"en": ["FOSSDA"]},
      "homepage": [
        {
          "id": "https://fossda.org",
          "type": "Text",
          "label": {"en": ["FOSSDA Homepage"]},
          "format": "text/html"
        }
      ],
      "logo": [
        {
          "id": "https://fossda.org/logo.png",
          "type": "Image",
          "format": "image/png"
        }
      ]
    }
  ],
  "media": {
    "video": [
      {
        "id": "video-main",
        "url": "https://fossda.org/media/larry-augustin-2024/video-hd.mp4",
        "format": "video/mp4",
        "duration": 6129,
        "width": 1920,
        "height": 1080,
        "quality": "hd"
      },
      {
        "id": "video-sd",
        "url": "https://fossda.org/media/larry-augustin-2024/video-sd.mp4",
        "format": "video/mp4",
        "duration": 6129,
        "width": 854,
        "height": 480,
        "quality": "sd"
      }
    ],
    "audio": [
      {
        "id": "audio-main",
        "url": "https://fossda.org/media/larry-augustin-2024/audio.mp3",
        "format": "audio/mpeg",
        "duration": 6129
      }
    ]
  },
  "transcript": {
    "language": "en",
    "segments": [
      {
        "id": "seg-001",
        "speaker_id": "participant-001",
        "speaker_name": "ELISABETTA MORI",
        "start_time": 0,
        "end_time": 60,
        "text": "FOSSDA, the Free and Open Source Stories Digital Archive Foundation. It's the 16th of April 2024 and I am Elisabetta Mori, an historian of computing currently based in Italy and an oral history interview with FOSSDA. Today I'll be talking to Larry Augustin. Larry Augustin is an entrepreneur, angel investor and advisor to technology companies. He He was the founder of VA Research that became VA Linux, SourceForge. He was part of the team who who coined the term Open Software. He was CEO of SugarCRM and the Vice President for Applications and and Web Services. We are recording on the theirstory.io and I am in Livorno, Tuscany, Italy, and Larry is in his home in Los Altos, California. So thank you and welcome, Larry.",
        "words": [
          {"word": "FOSSDA", "start": 0.0, "end": 0.8, "confidence": 0.98},
          {"word": "the", "start": 0.9, "end": 1.0, "confidence": 0.99},
          {"word": "Free", "start": 1.1, "end": 1.4, "confidence": 0.99},
          {"word": "and", "start": 1.5, "end": 1.7, "confidence": 0.99},
          {"word": "Open", "start": 1.8, "end": 2.1, "confidence": 0.99},
          {"word": "Source", "start": 2.2, "end": 2.6, "confidence": 0.99},
          {"word": "Stories", "start": 2.7, "end": 3.2, "confidence": 0.98},
          {"word": "Digital", "start": 3.3, "end": 3.8, "confidence": 0.99},
          {"word": "Archive", "start": 3.9, "end": 4.5, "confidence": 0.98},
          {"word": "Foundation", "start": 4.6, "end": 5.3, "confidence": 0.97}
        ]
      },
      {
        "id": "seg-002",
        "speaker_id": "participant-002",
        "speaker_name": "LARRY AUGUSTIN",
        "start_time": 60,
        "end_time": 64,
        "text": "Thank you, Elisabetta. Happy to be here. Happy to do this.",
        "words": [
          {"word": "Thank", "start": 60.0, "end": 60.3, "confidence": 0.99},
          {"word": "you", "start": 60.4, "end": 60.6, "confidence": 0.99},
          {"word": "Elisabetta", "start": 60.7, "end": 61.4, "confidence": 0.98},
          {"word": "Happy", "start": 61.8, "end": 62.1, "confidence": 0.99},
          {"word": "to", "start": 62.2, "end": 62.3, "confidence": 0.99},
          {"word": "be", "start": 62.4, "end": 62.5, "confidence": 0.99},
          {"word": "here", "start": 62.6, "end": 62.9, "confidence": 0.99}
        ]
      },
      {
        "id": "seg-003",
        "speaker_id": "participant-001",
        "speaker_name": "ELISABETTA MORI",
        "start_time": 64,
        "end_time": 68,
        "text": "Yeah, so let's start from the beginning. So where and when were you born?",
        "words": []
      },
      {
        "id": "seg-004",
        "speaker_id": "participant-002",
        "speaker_name": "LARRY AUGUSTIN",
        "start_time": 71,
        "end_time": 144,
        "text": "Oh, I was born 1962 in Dayton, Ohio, the middle of the country in the US. My father was in the Air Force and we had settled in Dayton and ended up growing up there. My mother's side of the family were farmers and had a farm in the east coast of the US, New Hampshire. And I spent a lot of times there. In fact, if you look at sort of my early life, the time I spent in summers working on the farm was part of what helped me become an engineer. My dad was an electrical engineer and so I sort of followed in his footsteps. That was my, you know, sort of goal a whole life was to follow in his footsteps and also be an electrical engineer. But I spent the summers working on the family farm in New Hampshire, you know, baling hay, doing, you know, everything around the place. And I developed this tendency to just fix things. It's part of what drove me to be an engineer.",
        "words": []
      },
      {
        "id": "seg-005",
        "speaker_id": "participant-002",
        "speaker_name": "LARRY AUGUSTIN",
        "start_time": 144,
        "end_time": 193,
        "text": "I often say, when you're out in the field and the tractor breaks, there's nobody to call. You know, we didn't have cell phones, there was no one there. You had to just fix things yourself. And so my whole life, that's how I kind of approach things, which is just learn to do whatever needs to be done and be hands-on and fix things. And what about your mom? What did she do? My mom is a nurse. She grew up on the farm and then she was able to go to nursing school and she became a nurse. And then, you know, after I came along, she retired from that and was a full-time mom.",
        "words": []
      },
      {
        "id": "seg-006",
        "speaker_id": "participant-001",
        "speaker_name": "ELISABETTA MORI",
        "start_time": 193,
        "end_time": 198,
        "text": "And who were the important influences on you in your early life?",
        "words": []
      },
      {
        "id": "seg-007",
        "speaker_id": "participant-002",
        "speaker_name": "LARRY AUGUSTIN",
        "start_time": 198,
        "end_time": 251,